"Deskripsi","Nama Hewan","Jenis Hewan"
"Pada bagian kepala terdapat mulut yang digunakan untuk mengunyah atau memamah makanan. Ada sepasang mata majemuk yang dapat membedakan gelap dan terang. Di kepala terdapat sepasang antena yang panjang alat indra yang dapat mendeteksi bau-bauan dan vibrasi di udara. Dalam keadaan istirahat kepalanya ditundukkan kebawah pronotum yang berbentuk seperti perisai. Pada bagian dada terdapat tiga pasang kaki dan sepasang sayang yang dapat menyebabkan kecoa bisa terbang dan berlari dengan cepat. Terdapat struktur seperti lempengan besar yang berfungsi menutupi dasar kepala dan sayap dibelakang kepala disebut pronotum. tubuh bulat telur dan pipih dorsoventral (gepeng). bagian dada terdapat 3 kaki,2 pasang sayap,bagian luar tebal,bagian dalam berbentuk membran. caput melengkung ke ventro caudal di bawah sehingga mulut menjol diantara dasar kaki pertama. biasanya bersayap 2 pasang jenis Blatta Orientialis betina memiliki sayap yang lebih pendek daripada jantan (tidak menutup abdomen). kaki disesuaikan untuk berlari. metamorfosis tidak sempurna (telur-nimpha-dewasa),telur terbungkus ooteca 6-30 butir telur dan menetas 26-69 hari sedangkan nimpha menjadi dewasa mengalami molting sebanyak 13 kali,siklus hidup secara keseluruhan 2-21 bulan dan kecoa dewasa dapat hidup selama 3 tahun. Kebiasaan hidupnya,kecoa termasuk binatang malam (nocturnal) yang dapat bergerak cepat dan selalu menghindari cahaya. Bersifat omnivora memakan buku,kotoran,tinja dan dahak atau makanan dari kanji.","Kecoa","Serangga"
"Antena, terletak pada bagian atas kepala, berfungsi sebagai alat peraba. bentuknya pun berbeda – beda, ada yang seperti bulu ayam dan sisir. Memang cukup unik, mengingat hewan seperti kupu-kupu atau serangga memiliki antena yang memiliki kemampuan sebagai alat peraba, tak heran jika hewan – hewan seperti ini begitu peka terhadap lingkungan. Antena tersebut dilengkapi dengan sel-sel syaraf, sehingga kupu-kupu dapat meraba. Mata, berbeda dengan hewan lain, mata kupu-kupu terbagi menjadi dua bagian, pertama adalah mata majemuk, yang dapat melihat atau mendeteksi setiap gerakan, namun mata ini tidak terlalu jelas bisa melihat benda. yang kedua adalah mata tunggal atau biasa disebut oseli, merupakan mata yang berfungsi mempertajam penglihatan dari mata majemuk. Mata ini tersembunyi dan terletak diantara rambut halus. Mulut, terbagi kedalam tiga bagian. 1) Labrum. 2) Labliam palpus, memiliki fungsi sebagai alat peraba, serta merupakan bagian bibir yang sangat sensitif. 3) Probocis atau madibula merupakan rahang bawah kupu – kupu yang awalnya sebagai alat penggigit. Namun probocis ini digunakan sebagai alat penghisap, sebagai contoh ketika kupu-kupu menghisap sari bunga. Alat ini memiliki bentuk seperti tabung, namun apabisa tidak digunakan alat ini otomatis akan menggulung. Dada atau thorax kupu-kupu terhubung dengan kepala melaui selaput atau membran yang berfungsi sebagai leher, sehingga bisa disibilang membran tersebut merupakan leher dari kupu-kupu. Selain itu thorax kupu-kupu memiliki ruas-ruas yang berbentuk kotak, serta kuat. Bagian ini merupakan bagian yang vital sebab thorax ini berisi otot – otot yang menjadikannya kuat, sehingga kupu-kupu dapat bergerak dan terbang. Kaki atau tungkai kupu-kupu memiliki ruas, dan bukan hanya satu, yaitu ruas dasar atau koksa, sendi paha atau trokanter, femur, tibia serta tasus. Untuk tarsus sendiri dilengkapidengan beberapa ruas serta memiliki kuku, untuk saat ini jumlah tarsus dari kupu-kupu tidak dapat dipastikan karena tergantung, jenis kupu-kupu dan kelamin kupu-kupu. Kupu-kupu memiliki kaki depan yang sensitif, karena berfungsi sebagai alat dalam mengenal lawan jenis atau bungan. Selai itu kaki depan ini biasanya  dilengkapi dengan spina dengan fungsi untuk membantu kupu-kupu dalam berjalan. Pada bagian dada ini juga dilengkapi sayap, dengan fungsi sebagai alat gerak kupu-kupu (terbang). Sayap kupu-kupu memiliki ukuran yang tipis, serta menempel ke dada atau thorax. Pada dasarnya sayap kupu-kupu tidaklah berwarna, akan tetapi warna yang dihasilkan merupakan warna dari sisik yang menutupi sayap. Akan tetapi tidak semua kupu-kupu memiliki sayap.","kupu-kupu","Serangga"
"Belalang kayu ini memiliki bentuk tubuh yang terdiri dari 3 bagian utama, yaitu kepala, dada ( thorak ) dan perut ( abdomen ). Belalang kayu juga  memiliki 6 kaki yang bersendi, 2 pasang sayap, dan 2 antena. Kaki bagian belakang panjang yang digunakan untuk melompat dengan jauh dan tinggi, sedangkan kaki bagian depan pendek digunakan untuk berjalan. Belalang juga memiliki pendengaran yang tajam, meskipun tidak memiliki telinga. Alat pendengar belalang ini hampir disebut dengan nama tympanum dan terletak pada abdmon ( perut ) dekat bagian sayap. Typnpanum ini berbentuk sebuah disk bulat besar yang terdiri dari beberapa bagian prosesor dan memiliki syaraf uang digunakan untuk memantau getaran dari udara. Mata yang sederhana berfungsi untuk merasakan intensitas cahaya, mata belalang yang besar berfungsi untuk mencakup penglihatan yang luas. Belalang kayu juga memiliki 5 mata ( 2 compound eye dan 3 ecelli ). Belalang kayu ini termasuk hewan serangga yang bernafas menggunakan trakea, dan masuk kedalam kelompok hewa berkerangka luas ( exoskeleton ). Belalang kayu dewasa betina memiliki ukuran lebih besar dibandingkan dengan belalang jantan dewasa  yaitu berkisar 58-71 mm sedangkan belalang jantan dewasa berkisar 49-63 mm dengan berat tubuh rata – rata mencapai 2-3 gram. Belalang kebanyakan memakan tumbuhan yang berarti termasuk hewan herbivora. Beberapa spesies hidup di tanaman inang dan memakan daun, bunga, batang dan bijinya. Spesies belalang lain memakan apa yang mereka temukan di tanah, seperti potongan daun dan bunga, biji bahkan serangga mati. Tapi belalang bisa pilih-pilih tentang makanan mereka. Mereka sering mencicipi makanan sebelum mulai dikonsumsi. Biasanya, belalang memilih makanan yang menghasilkan asam amino, gula dan vitamin yang tepat.","belalang kayu","Serangga"
"Kuda laut adalah jenis ikan yang hidup di laut dari genus Hippocampus dan famili Syngnathidae. Hewan dengan ukuran yang bervariasi antara 16 mm (untuk spesies Hippocampus denise) sampai 35 cm ini dapat ditemukan di perairan tropis dan menengah di seluruh dunia. Kuda laut merupakan satu-satunya spesies yang jantannya dapat hamil.

Sirip dorsal pada kuda laut terletak pada bagian bawah sedangkan sirip pektoralnya terletak pada bagian kepala, di dekat insang. Beberapa spesies kuda laut berwarna transparan sebagian, sehingga tidak mudah terlihat.

Populasi kuda laut terancam karena penangkapan yang berlebihan. Kuda laut dimanfaatkan pada herbologi tradisional Tiongkok dan sebanyak 20 juta kuda laut telah ditangkap setiap tahunnya untuk keperluan ini. Impor ekspor kuda laut diatur dalam CITES sejak 15 Mei 2004.","Kuda Laut","Ikan"
"Landak laut atau disebut juga bulu babi (Echinoidea) merupakan hewan laut yang berbentuk bundar dan memiliki duri pada kulitnya yang dapat digerakkan. Binatang ini terbagi menjadi sekitar 950 spesies dan dapat ditemukan mulai dari daerah pasang surut sampai di kedalaman 5.000 meter.","Bulu Babi","Ikan"
"Kijang atau muncak adalah kerabat rusa yang tergabung dalam genus Muntiacus. Kijang berasal dari Dunia Lama dan dianggap sebagai jenis rusa tertua, telah ada sejak 15-35 juta tahun yang lalu, dengan sisa-sisa dari masa Miosen ditemukan di Prancis dan Jerman.

Pada masa sekarang, muncak hanya dapat ditemui di Asia Selatan dan Asia Tenggara, mulai dari India, Srilangka, Indocina, hingga kepulauan Nusantara. Beberapa jenis diintroduksi di Inggris dan sekarang banyak dijumpai di sana.

Kijang tidak mengenal musim kawin dan dapat kawin kapan saja, tetapi perilaku musim kawin muncul bila kijang dibawa ke daerah beriklim sedang. Jantannya memiliki tanduk pendek yang dapat tumbuh bila patah.

Hewan ini sekarang menarik perhatian penelitian evolusi molekular karena memiliki variasi jumlah kromosom yang dramatis dan ditemukannya beberapa jenis baru (terutama di Indocina).","Kijang","Mamalia"
"Burung walet (Collocalia vestita) merupakan burung dengan sayap meruncing, berekor panjang, berwarna hitam dengan bagian bawah tubuhnya berwarna coklat. Burung walet hidup di pantai serta daerah permukiman, menghuni gua atau ruang besar, seperti bubungan kosong. Burung Walet tidak dapat bertengger karena memiliki kaki yang sangat pendek sehingga sangat jarang berdiri di atas tanah tetapi bisa menempel pada dinding tembok atau atap. Mampu terbang ditempat gelap dengan bantuan Ekolokasi. Bersarang secara berkelompok dengan sarang yang dibuat dari air liur. Sarang ini banyak diperdagangkan orang untuk dibuat sup atau bahan obat-obatan.[1]

Habitat atau kumpulan komunitas Burung walet hanya ditemui di lingkup Asia Tenggara burung walet banyak sekali dijumpai di Indonesia, Malaysia, Thailand, Vietnam, Filipina Kamboja, dan Laos, Burung Walet tidak di temui di negara Eropa, Amerika, ataupun di benua afrika. Hal ini dikarenan perkembang biakan burung walet harus di daerah yang beriklim tropis dengan curah hujan yang tinggi. karena berpengaruh dengan unsur kelembapan sebagai faktor berkembang biaknya habitat spesies atau populasi dari burung walet.","Walet","Burung"
"Merpati dan dara termasuk dalam famili Columbidae atau burung berparuh merpati dari ordo Columbiformes, yang mencakup sekitar 300 spesies burung kerabat pekicau. Dalam percakapan umum, istilah ""dara"" dan ""merpati"" dapat saling menggantikan. Dalam praktik ornitologi, terdapat suatu kecenderungan ""dara"" digunakan untuk spesies yang lebih kecil dan ""merpati"" untuk yang besar, tetapi hal ini tidak secara konsisten diterapkan, dan secara historis nama umum untuk burung-burung tersebut memiliki banyak variasi antara istilah ""dara"" dan ""merpati."" Famili ini terdapat di seluruh dunia, tetapi varietas terbesar terdapat di Indomalaya dan Ekozona Australasia. Dara dan merpati muda disebut ""squabs.""

Merpati dan dara adalah burung berbadan gempal dengan leher pendek dan paruh ramping pendek dengan cere berair. Spesies yang umumnya dikenal sebagai ""merpati"" adalah merpati karang liar, umum digunakan di banyak kota.

Dara dan merpati membangun sangkarnya dari ranting dan sisa-sisa lainnya, yang ditempatkan di pepohonan, birai, atau tanah, tergantung spesiesnya. Mereka mengerami satu atau dua telur, dan kedua induknya sangat memedulikan anaknya, yang akan meninggalkan sangkarnya setelah 7 hingga 28 hari.[1] Dara makan biji, buah dan tanaman. Tidak seperti kebanyakan burung lainnya (namun lihat juga flamingo), dara dan merpati menghasilkan ""susu tembolok."" Kedua jenis kelamin menghasilkan zat bernutrisi tinggi ini untuk memberi makan anaknya.","Merpati","Burung"
"Trenggiling (juga disebut sebagai pemakan-semut bersisik) adalah mamalia dari ordo Pholidota. Satu keluarga yang masih ada, Manidae, memiliki tiga genera, Manis yang terdiri dari empat spesies yang hidup di Asia, Phataginus yang terdiri dari dua spesies hidup di Afrika, dan Smutsia yang terdiri dari dua spesies juga tinggal di Afrika.[2] Spesies ini berbagai ukuran dari 30 100 cm (12-39 in). Sejumlah spesies trenggiling punah juga diketahui. Nama pangolin berasal dari kata Melayu ""pengguling"". Trenggiling ditemukan secara alami di daerah tropis di seluruh Afrika dan Asia.","Trenggiling","Mamalia"
"Koala (Phascolarctos cinereus) adalah salah satu binatang berkantung (marsupial) khas dari Australia dan merupakan wakil satu-satunya dari keluarga Phascolarctidae.

Pada umumnya, banyak dikatakan bahwa kata koala berasal dari bahasa Australia pribumi yang berarti tidak minum. Koala sebenarnya minum air tetapi sangat jarang karena makanannya, daun ekaliptus, sudah mengandung cukup air sehingga koala tidak perlu turun dari pohon untuk minum.

Koala dapat ditemukan di sepanjang pesisir timur Australia mulai dari Adelaide sampai ke Semenanjung Cape York, dan sampai jauh ke pedalaman karena terdapat curah hujan yang cukup untuk mendukung hutan yang cocok bagi koala.

Koala mirip dengan wombat (saudara terdekat mereka), namun memiliki bulu yang lebih tebal dan lembut, telinga yang lebih besar, dan kaki-tangan yang lebih panjang dilengkapi dengan cakar yang besar dan panjang untuk membantunya memanjat.

Beratnya bervariasi mulai dari 14 kg untuk jantan selatan yang besar, sampai 5 kg untuk betina utara yang kecil. Mereka biasanya diam, akan tetapi koala jantan memiliki teriakan penarik yang kuat yang dapat didengar hampir satu kilometer pada musim kawin.

Koala hidup hanya dari daun ekaliptus. Daun ekaliptus mengandung protein dalam jumlah rendah, zat tak tercerna dalam kadar tinggi, dan mengandung senyawa fenol dan terpena yang beracun bagi spesies lain. Seperti wombat dan kukang, koala memiliki tingkat metabolisme yang rendah untuk seekor mamalia serta istirahat tanpa bergerak sekitar 20 jam sehari, dan kebanyakan waktu tersebut digunakan untuk tidur. Mereka makan tidak tergantung waktu, tetapi biasanya pada malam hari. Koala umumnya memakan 500 gram daun eucalyptus per hari, mengunyah mereka sampai menjadi pasta yang halus sebelum menelannya. Hatinya memisahkan bahan beracun dan siap untuk dibuang, dan ""hind gut""nya (terutama caecum) lebih cenderung untuk mengambil jumlah nutrisi maksimum dari makanan yang berkualitas rendah.","Koala","Mamalia"
"Simpanse adalah anggota dari keluarga Hominidae, bersama dengan gorila, manusia, dan orangutan. Simpanse terpisah dengan manusia dalam ranting keluarga sekitar 4 - 6 juta tahun lalu. Dua spesies simpanse di atas adalah kerabat terdekat manusia, semuanya anggota dari suku Hominini (berikut dengan spesies yang punah dari sub-suku Hominina). Simpanse satu-satunya anggota yang diketahui dari sub-suku Panina. Kedua spesies Pan tersebut terpisah sekitar 1 juta tahun lalu.
Kebanyakan simpanse jantan memiliki tinggi 1.7 m saat berdiri, dan memiliki berat 70 kg; yang betina lebih kecil. Panjang tangan simpanse umumnya, bila dilebarkan, memiliki rentang satu setengah kali tinggi badan dan tangan simpanse lebih panjang dari kakinya.[6] Bonobo sedikit pendek dan kurus daripada kebanyakan simapanse tetapi memiliki tungkai yang lebih panjang. Kedua spesies menggunakan tangannya yang panjang dan kuat untuk memanjat pohon. Di tanah, simpanse biasanya berjalan menggunakan keempatnya dengan bantuan baku tangan dan kepalan tangan, sebuah bentuk tenaga penggerak yang disebut dengan knuckle-walking. Kaki simpanse lebih cocok untuk berjalan dibandingkan orangutan karena telapak kaki simpanse lebih luas dan jempol yang pendek. Simpanse biasa dan bonobo dapat berjalan tegak dengan dua kaki saat membawa barang dengan kedua tangannya. Bonobo secara proporsional memiliki tungkai lebih panjang dan cenderung sering berjalan tegak dibandingkan Simpanse Biasa. Kulitnya lebih gelap; wajah, tangan, telapak tangan dan kaki tidak berbulu; dan simpanse tidak memiliki ekor. Kedua spesies memiliki warna pada kulit luar wajah, tangan dan kaki yang beragam dari merah jambu sampai berwarna gelap, tetapi memiliki warna lebih terang pada saat muda, menjadi lebih gelap saat menua. Penelitian Universitas Chicago Medical Center menemukan perbedaan genetis yang signifikan antara populasi simpanse.[7] Tonjolan bertulang diatas mata memberikan tampilan mundur pada dahi, dan hidungnya datar. Walaupun dengan mulut menonjol, bibirnya hanya mendorong kedepan saat simpanse mencibir. Otak simpanse setengah dari ukuran otak manusia.[8]

Testikel simpanse lebih besar untuk ukuran badannya, dengan kombinasi berat sekitar 110 gram dibandingkan dengan gorilla 28 gram atau manusia 43 g. Hal ini secara umum diatribusikan pada kompetisi sperma karena sifat poliandri alamiah pada perilaku perkawinan simpanse.[9] Simpanse mencapai masa puberti pada umur antara 8 dan 10 tahun, dan jarang hidup melebihi umur 40 di alam liar, tetapi diketahui hidup sampai 60 tahun selama penangkaran.","Simpanse","Mamalia"
"Kutu mengacu pada berbagai artropoda berukuran kecil hingga sangat kecil. Nama ini dipakai untuk sejumlah krustasea air kecil (seperti kutu air), serangga (seperti kutu kepala dan kutu daun), serta — secara salah kaprah — berbagai anggota Acarina (tungau dan caplak, yang berkerabat lebih dekat dengan laba-laba daripada serangga). Semua disebut ""kutu"" karena ukurannya yang kecil. Dengan demikian, pengertian awam istilah ini tidak memiliki arti taksonomi.

Dalam arti lebih sempit, kutu adalah serangga yang tidak bersayap dan berukuran kecil, yang dalam bahasa Inggris mencakup flea (kutu yang melompat, ordo Siphonaptera) dan louse (kutu yang lebih suka merayap, kebanyakan ordo Phtiraptera yang semuanya adalah parasit). Dalam bahasa Indonesia keduanya tidak dibedakan, malah mencakup juga sebagian dari kerabat wereng (ordo Hemiptera) dan beberapa anggota ordo Coleoptera. Untuk menjelaskan, diberi keterangan di belakang kata ""kutu"". Para biologiwan berusaha mendayagunakan kata tuma bagi kelompok Phtiraptera, walaupun menyadari terdapat kesulitan dalam penerapannya.","Kutu","Serangga"
"Sidat atau belut (ordo Anguilliformes) atau yang biasa di sebut belut adalah kelompok ikan yang memiliki tubuh berbentuk menyerupai ular. Ikan ini masuk dalam Ordo Anguilliformes, yang terdiri atas 4 subordo, 19 famili, 110 genera, dan 400 spesies. Kebanyakan hidup di laut namun ada pula yang hidup di air tawar.","Belut","Ikan"
"Kura-kura dan penyu adalah hewan bersisik berkaki empat yang termasuk golongan reptil. Bangsa hewan yang disebut (ordo) Testudinata (atau Chelonians) ini khas dan mudah dikenali dengan adanya ‘rumah’ atau batok (bony shell) yang keras dan kaku.

Batok kura-kura ini terdiri dari dua bagian. Bagian atas yang menutupi punggung disebut karapas (carapace) dan bagian bawah (ventral, perut) disebut plastron. Kemudian setiap bagiannya ini terdiri dari dua lapis. Lapis luar umumnya berupa sisik-sisik besar dan keras, dan tersusun seperti genting; sementara lapis bagian dalam berupa lempeng-lempeng tulang yang tersusun rapat seperti tempurung. Perkecualian terdapat pada kelompok labi-labi (Trionychoidea) dan jenis penyu belimbing, yang lapis luarnya tiada bersisik dan digantikan lapisan kulit di bagian luar tempurung tulangnya.

Dalam bahasa Indonesia, kita mengenal tiga kelompok hewan yang termasuk bangsa ini, yalah penyu (bahasa Inggris: sea turtles), labi-labi atau bulus (freshwater turtles), dan kura-kura (tortoises). Dalam bahasa Inggris, dibedakan lagi antara kura-kura darat (land tortoises) dan kura-kura air tawar (freshwater tortoises atau terrapins).Kura-kura hidup di berbagai tempat, mulai daerah gurun, padang rumput, hutan, rawa, sungai dan laut. Sebagian jenisnya hidup sepenuhnya akuatik, baik di air tawar maupun di lautan. Kura-kura ada yang bersifat pemakan tumbuhan (herbivora), pemakan daging (karnivora) atau campuran (omnivora).

Kura-kura tidak memiliki gigi. Akan tetapi perkerasan tulang di moncong kura-kura sanggup memotong apa saja yang menjadi makanannya.

Ukuran tubuh kura-kura bermacam-macam, ada yang kecil ada yang besar. Biasanya ditunjukkan dengan panjang karapasnya (CL, carapace length). Kura-kura terbesar adalah penyu belimbing, yang karapasnya dapat mencapai panjang 300 cm. Labi-labi terbesar adalah labi-labi moncong babi, dengan panjang karapas sekitar 0.7 meter. Sementara kura-kura raksasa dari Kep. Galapagos dan Kep. Seychelles panjangnya dapat melebihi 0.7 meter. Sedangkan yang terkecil adalah kura-kura mini dari Afrika Selatan, yang panjang karapasnya tidak melebihi 8 cm.

Kura-kura berbiak dengan bertelur (ovipar). Sejumlah beberapa butir (pada kura-kura darat) hingga lebih dari seratus butir telur (pada beberapa jenis penyu) diletakkan setiap kali bertelur, biasanya pada lubang pasir di tepi sungai atau laut, untuk kemudian ditimbun dan dibiarkan menetas dengan bantuan panas matahari. Telur penyu menetas kurang lebih setelah dua bulan (50-70 hari) tersimpan di pasir.

Jenis kelamin anak kura-kura yang bakal lahir salah satunya ditentukan oleh suhu pasir tempat telur-telur itu tersimpan. Pada kebanyakan jenis kura-kura, suhu di atas rata-rata kebiasaan akan menghasilkan hewan betina. Dan sebaliknya, suhu di bawah rata-rata cenderung menghasilkan banyak hewan jantan.

Kura-kura termasuk salah satu jenis hewan yang berumur panjang. Reptil ini dapat hidup puluhan tahun, bahkan seekor kura-kura darat dari Kep. Seychelles tercatat hidup selama 152 tahun (1766 – 1918).

Bagaimana batok kura-kura itu terbentuk dan berkembang dalam proses evolusinya, belum diperoleh keterangan yang jelas. Fosil kura-kura tertua kedua yang berasal dari Masa Trias (sekitar 210 juta tahun silam), Proganochelys, telah berbentuk mirip dengan kura-kura masa kini. Perbedaannya, tulang belulang di bagian punggung belum begitu melebar dan belum semuanya menyatu membentuk tempurung yang sempurna. Kura-kura purba hidup dan berkembang kurang lebih sejaman dengan dinosaurus. Archelon, misalnya, merupakan kura-kura raksasa yang diameter tubuhnya dapat mencapai lebih dari 4 m. Fosil kura-kura tertua yang ditemukan saat ini adalah Odontochelys yang berasal dari sekitar 2 tahun silam.

Banyak jenis kura-kura yang hidup sekarang mampu menyembunyikan kepala, kaki dan ekornya ke dalam tempurungnya, sehingga dapat menyelamatkan diri. Namun beberapa kura-kura primitif, seperti contohnya penyu, tak dapat menarik masuk anggota badannya itu.","Kura - Kura","Amfibi"
"enyu adalah kura-kura laut yang ditemukan di semua samudra di dunia. Menurut data para ilmuwan, penyu sudah ada sejak akhir zaman Jura (145 - 208 juta tahun yang lalu) atau seusia dengan dinosaurus. Pada masa itu Archelon, yang berukuran panjang badan enam meter, dan Cimochelys telah berenang di laut purba seperti penyu masa kini.

Penyu memiliki sepasang tungkai depan yang berupa kaki pendayung yang memberinya ketangkasan berenang di dalam air. Walaupun seumur hidupnya berkelana di dalam air, sesekali hewan kelompok vertebrata, kelas reptilia itu tetap harus sesekali naik ke permukaan air untuk mengambil napas. Itu karena penyu bernapas dengan paru-paru. Penyu pada umumnya bermigrasi dengan jarak yang cukup jauh dengan waktu yang tidak terlalu lama. Jarak 3.000 kilometer dapat ditempuh 58 - 73 hari.

Penyu mengalami siklus bertelur yang beragam, dari 2 - 8 tahun sekali. Sementara penyu jantan menghabiskan seluruh hidupnya di laut, betina sesekali mampir ke daratan untuk bertelur. Penyu betina menyukai pantai berpasir yang sepi dari manusia dan sumber bising dan cahaya sebagai tempat bertelur yang berjumlah ratusan itu, dalam lubang yang digali dengan sepasang tungkai belakangnya. Pada saat mendarat untuk bertelur, gangguan berupa cahaya ataupun suara dapat membuat penyu mengurungkan niatnya dan kembali ke laut, juga penyu menggunakan magnetism bumi sebagai bantuan untuk kembali ke kampung halamannya ketika saat masih menjadi tukik, dan kembali saat sudah dewasa untuk bertelur.

Penyu yang menetas di perairan pantai Indonesia ada yang ditemukan di sekitar kepulauan Hawaii. Penyu diketahui tidak setia pada tempat kelahirannya.

Tidak banyak regenerasi yang dihasilkan seekor penyu. Dari ratusan butir telur yang dikeluarkan oleh seekor penyu betina, paling banyak hanya belasan tukik (bayi penyu) yang berhasil sampai ke laut kembali dan tumbuh dewasa. Itu pun tidak memperhitungkan faktor perburuan oleh manusia dan pemangsa alaminya seperti kepiting, burung dan tikus di pantai, serta ikan-ikan besar begitu tukik tersebut menyentuh perairan dalam.

Di tempat-tempat yang populer sebagai tempat bertelur penyu biasanya sekarang dibangun stasiun penetasan untuk membantu meningkatkan tingkat kelulushidupan (survival)","Penyu","Ikan"
"Lintah dan pacet adalah hewan yang tergabung dalam filum Annelida subkelas Hirudinea. Terdapat jenis lintah yang dapat hidup di daratan, air tawar, dan laut. Seperti halnya kerabatnya, Oligochaeta, mereka memiliki klitelum untuk menyimpan telur-telur pada segmen-segmen tertentu. Seperti Oligochaeta, lintah juga hermafrodit (berkelamin ganda). Lintah obat Eropa, Hirudo medicinalis, telah sejak lama dimanfaatkan untuk pengeluaran darah (plebotomi) secara medis.

Lintah dibedakan dari pacet bukan berdasarkan taksonomi, tetapi lebih pada habitat kesukaannya. Lintah sehari-hari hidup di air, sedangkan pacet sehari-harinya melekat pada daun atau batang pohon (di luar air).

Semua spesies lintah adalah karnivora. Beberapa merupakan predator, mendapat makanan dari berbagai jenis invertebrata seperti cacing, siput, atau larva serangga.","Lintah","Invertebrata"
