"Deskripsi","Nama Hewan","Jenis Hewan"
"Cacing tanah adalah cacing berbentuk tabung dan tersegmentasi dalam filum Annelida. Mereka umumnya ditemukan hidup di tanah, memakan bahan organik hidup dan mati. Sistem pencernaan berjalan melalui panjang tubuhnya. Cacing tanah melakukan respirasi melalui kulitnya. Cacing tanah memiliki sistem transportasi ganda terdiri dari cairan selom yang bergerak dalam selom yang berisi cairan dan sistem peredaran darah tertutup sederhana. Memiliki sistem saraf pusat dan perifer. Sistem saraf pusat terdiri dari dua ganglia atas mulut, satu di kedua sisi, terhubung ke tali saraf berlari kembali sepanjang panjangnya ke neuron motor dan sel-sel sensorik di setiap segmen. Sejumlah besar kemoreseptor terkonsentrasi di dekat mulutnya. Otot melingkar dan longitudinal di pinggiran setiap segmen memungkinkan cacing untuk bergerak. Set yang sama otot garis usus, dan tindakan mereka memindahkan makanan mencerna menuju anus cacing.[2]

Cacing tanah adalah hermafrodit - masing-masing individu membawa kedua organ seks pria dan wanita. Mereka tidak memiliki kerangka internal atau eksoskeleton, tetapi mempertahankan struktur mereka dengan ruang coelom cairan yang berfungsi sebagai rangka hidrostatik.

""Cacing tanah"" adalah nama umum untuk anggota terbesar dari Oligochaeta (yang merupakan kelas atau upakelas tergantung pada penulis). Dalam sistem klasik, mereka ditempatkan dalam ordo Opisthopora, atas dasar pori-pori jantan membuka posterior ke pori-pori betina, meskipun segmen jantan internal anterior ke betina. Studi kladistik teoretis telah menempatkan mereka, sebaliknya, dalam subordo Lumbricina dari ordo Haplotaxida, tetapi ini mungkin lagi segera berubah.

Cacing tanah darat yang lebih besar juga disebut megadriles (atau cacing besar), yang bertentangan dengan microdriles (atau cacing kecil) di familia semiakuatik Tubificidae, Lumbriculidae, dan Enchytraeidae, antara lain. Megadriles ditandai dengan memiliki klitelum yang berbeda (yang lebih luas daripada microdriles) dan sistem vaskular dengan kapiler benar.

Cacing tanah jauh lebih melimpah di lingkungan terganggu dan biasanya aktif hanya jika air hadir.

Cacing tanah jenis Lumbricus mempunyai bentuk tubuh pipih.[butuh rujukan] Jumlah segmen yang dimiliki sekitar 90-195 dan klitelum yang terletak pada segmen 27-32.[butuh rujukan] Biasanya jenis ini kalah bersaing dengan jenis yang lain sehingga tubuhnya lebih kecil.[butuh rujukan] Tetapi bila diternakkan besar tubuhnya bisa menyamai atau melebihi jenis lain.[butuh rujukan]

Cacing tanah jenis Pheretima segmennya mencapai 95-150 segmen.[butuh rujukan] Klitelumnya terletak pada segmen 14-16.[butuh rujukan] Tubuhnya berbentuk gilik panjang dan silindris berwarna merah keunguan. Cacing tanah yang termasuk jenis Pheretima antara lain cacing merah, cacing koot dan cacing kalung.","Cacing Tanah","Invertebrata"
"Marmot adalah sejenis hewan pengerat yang tergolong familia Sciuridae (bajing) dengan genus Marmota.

Marmot umumnya hidup di daerah pegunungan, seperti Alpen atau Pirenia di Eropa, Pegunungan Rocky atau Sierra Nevada di Amerika Serikat, dan Kanada bagian utara. Marmot umumnya membuat sarang di dalam tanah dan melakukan hibernasi selama musim dingin. Kebanyakan marmot tergolong hewan sosial; marmot berkomunikasi satu sama lain dengan siulan nyaring, terutama jika merasa ada bahaya.

Nama marmot berasal dari bahasa Latin mures monti (""tikus gunung""), dari bahasa Latin Klasik mures alpini (""tikus Alpen"").

Hewan lain yang berukuran serupa tetapi lebih bersifat sosial, anjing prairi, tidak digolongkan dalam genus Marmota, tetapi dalam genus Cynomys. Sementara itu, dalam bahasa Indonesia, tikus belanda (guinea pig) sering disebut juga sebagai marmot, walaupun sebenarnya hewan pengerat tersebut berasal yang tergolong familia yang berbeda.

Makanan utama marmot ialah tumbuh-tumbuhan, misalnya rumput-rumputan, buah beri, lumut kerak, lumut daun, akar-akaran, dan bunga.","Marmot","Mamalia"
